

================================================================
== Vitis HLS Report for 'read_input'
================================================================
* Date:           Sat Feb 14 12:50:29 2026

* Version:        2024.1 (Build 5069499 on May 21 2024)
* Project:        cnn_accl
* Solution:       hls (Vivado IP Flow Target)
* Product family: zynquplus
* Target device:  xczu7ev-ffvc1156-2-e


================================================================
== Performance Estimates
================================================================
+ Timing: 
    * Summary: 
    +--------+----------+----------+------------+
    |  Clock |  Target  | Estimated| Uncertainty|
    +--------+----------+----------+------------+
    |ap_clk  |  10.00 ns|  1.917 ns|     2.70 ns|
    +--------+----------+----------+------------+

+ Latency: 
    * Summary: 
    +---------+---------+----------+----------+-----+-----+-----------------------------------------------+
    |  Latency (cycles) |  Latency (absolute) |  Interval |                    Pipeline                   |
    |   min   |   max   |    min   |    max   | min | max |                      Type                     |
    +---------+---------+----------+----------+-----+-----+-----------------------------------------------+
    |      785|      785|  7.850 us|  7.850 us|  784|  784|  loop auto-rewind stp(delay=0 clock cycles(s))|
    +---------+---------+----------+----------+-----+-----+-----------------------------------------------+

    + Detail: 
        * Instance: 
        N/A

        * Loop: 
        +------------------+---------+---------+----------+-----------+-----------+------+----------+
        |                  |  Latency (cycles) | Iteration|  Initiation Interval  | Trip |          |
        |     Loop Name    |   min   |   max   |  Latency |  achieved |   target  | Count| Pipelined|
        +------------------+---------+---------+----------+-----------+-----------+------+----------+
        |- VITIS_LOOP_9_1  |      783|      783|         1|          1|          1|   784|       yes|
        +------------------+---------+---------+----------+-----------+-----------+------+----------+

============================================================
+ Verbose Summary: Synthesis Manager
============================================================
InlineROM: 1
ExposeGlobal: 0
============================================================
+ Verbose Summary: CDFG Model
============================================================
IsTopModel: 0
ResetActiveHigh: 1
IsCombinational: 2
IsDatapathOnly: 0
HasWiredReturn: 1
HasMFsm: 2
HasVarLatency: 1
IsPipeline: 0
IsRtlPipelined: 0
IsInstanceOverlapped: 0
IsDontTouch: 0
HasImplIP: 0
IsGatedGlobalClock: 0

+ Individual pipeline summary: 
  * Pipeline-0: initiation interval (II) = 1, depth = 1


============================================================
+ Verbose Summary: Schedule
============================================================
* Number of FSM states : 1
* Pipeline : 1
  Pipeline-0 : II = 1, D = 1, States = { 1 }
* Dataflow Pipeline: 0

* FSM state transitions: 
1 --> 

* FSM state operations: 

State 1 <SV = 0> <Delay = 1.91>
ST_1 : Operation 4 [1/1] (0.00ns)   --->   "%i1 = alloca i32 1"   --->   Operation 4 'alloca' 'i1' <Predicate = true> <Delay = 0.00>
ST_1 : Operation 5 [1/1] (0.00ns)   --->   "%specaxissidechannel_ln0 = specaxissidechannel void @_ssdm_op_SpecAXISSideChannel, i32 %in_stream_V_data_V, i4 %in_stream_V_keep_V, i4 %in_stream_V_strb_V, i1 %in_stream_V_user_V, i1 %in_stream_V_last_V, i1 %in_stream_V_id_V, i1 %in_stream_V_dest_V, void @empty_5"   --->   Operation 5 'specaxissidechannel' 'specaxissidechannel_ln0' <Predicate = true> <Delay = 0.00>
ST_1 : Operation 6 [1/1] (0.00ns)   --->   "%specinterface_ln0 = specinterface void @_ssdm_op_SpecInterface, i32 %img_stream, void @empty_4, i32 0, i32 0, void @empty_1, i32 0, i32 0, void @empty_1, void @empty_1, void @empty_1, i32 0, i32 0, i32 0, i32 0, void @empty_1, void @empty_1, i32 4294967295, i32 0, i32 0"   --->   Operation 6 'specinterface' 'specinterface_ln0' <Predicate = true> <Delay = 0.00>
ST_1 : Operation 7 [1/1] (0.00ns)   --->   "%specinterface_ln0 = specinterface void @_ssdm_op_SpecInterface, i1 %in_stream_V_dest_V, i1 %in_stream_V_id_V, i1 %in_stream_V_last_V, i1 %in_stream_V_user_V, i4 %in_stream_V_strb_V, i4 %in_stream_V_keep_V, i32 %in_stream_V_data_V, void @empty, i32 1, i32 1, void @empty_0, i32 0, i32 0, void @empty_1, void @empty_1, void @empty_1, i32 0, i32 0, i32 0, i32 0, void @empty_1, void @empty_1, i32 4294967295, i32 0, i32 0"   --->   Operation 7 'specinterface' 'specinterface_ln0' <Predicate = true> <Delay = 0.00>
ST_1 : Operation 8 [1/1] (0.42ns)   --->   "%store_ln0 = store i10 0, i10 %i1"   --->   Operation 8 'store' 'store_ln0' <Predicate = true> <Delay = 0.42>
ST_1 : Operation 9 [1/1] (0.00ns)   --->   "%br_ln9 = br void %for.inc.split" [cnn.cpp:9]   --->   Operation 9 'br' 'br_ln9' <Predicate = true> <Delay = 0.00>
ST_1 : Operation 10 [1/1] (0.00ns)   --->   "%i1_load = load i10 %i1" [cnn.cpp:9]   --->   Operation 10 'load' 'i1_load' <Predicate = true> <Delay = 0.00>
ST_1 : Operation 11 [1/1] (0.00ns)   --->   "%specpipeline_ln10 = specpipeline void @_ssdm_op_SpecPipeline, i32 1, i32 0, i32 0, i32 0, void @empty_1" [cnn.cpp:10]   --->   Operation 11 'specpipeline' 'specpipeline_ln10' <Predicate = true> <Delay = 0.00>
ST_1 : Operation 12 [1/1] (0.00ns)   --->   "%speclooptripcount_ln9 = speclooptripcount void @_ssdm_op_SpecLoopTripCount, i64 784, i64 784, i64 784" [cnn.cpp:9]   --->   Operation 12 'speclooptripcount' 'speclooptripcount_ln9' <Predicate = true> <Delay = 0.00>
ST_1 : Operation 13 [1/1] (0.00ns)   --->   "%specloopname_ln9 = specloopname void @_ssdm_op_SpecLoopName, void @empty_8" [cnn.cpp:9]   --->   Operation 13 'specloopname' 'specloopname_ln9' <Predicate = true> <Delay = 0.00>
ST_1 : Operation 14 [1/1] (0.07ns)   --->   "%empty = read i44 @_ssdm_op_Read.axis.volatile.i32P0A.i4P0A.i4P0A.i1P0A.i1P0A.i1P0A.i1P0A, i32 %in_stream_V_data_V, i4 %in_stream_V_keep_V, i4 %in_stream_V_strb_V, i1 %in_stream_V_user_V, i1 %in_stream_V_last_V, i1 %in_stream_V_id_V, i1 %in_stream_V_dest_V" [cnn.cpp:11]   --->   Operation 14 'read' 'empty' <Predicate = true> <Delay = 0.07> <CoreInst = "regslice">   --->   Core 148 'regslice' <Latency = 0> <II = 1> <Delay = 0.65> <Adapter> <Opcode : 'read' 'write'>
ST_1 : Operation 15 [1/1] (0.00ns)   --->   "%in_val_data = extractvalue i44 %empty" [cnn.cpp:11]   --->   Operation 15 'extractvalue' 'in_val_data' <Predicate = true> <Delay = 0.00>
ST_1 : Operation 16 [1/1] (1.83ns)   --->   "%write_ln14 = write void @_ssdm_op_Write.ap_fifo.volatile.i32P0A, i32 %img_stream, i32 %in_val_data" [cnn.cpp:14]   --->   Operation 16 'write' 'write_ln14' <Predicate = true> <Delay = 1.83> <CoreInst = "FIFO_SRL">   --->   Core 80 'FIFO_SRL' <Latency = 0> <II = 1> <Delay = 1.83> <Storage> <Opcode : 'read' 'write' 'nbread' 'nbwrite'> <Ports = 0> <Width = 32> <Depth = 2> <FIFO>
ST_1 : Operation 17 [1/1] (0.78ns)   --->   "%i = add i10 %i1_load, i10 1" [cnn.cpp:9]   --->   Operation 17 'add' 'i' <Predicate = true> <Delay = 0.78> <CoreInst = "Adder">   --->   Core 1 'Adder' <Latency = 0> <II = 1> <Delay = 0.78> <FuncUnit> <Opcode : 'add' 'sub'> <InPorts = 2> <OutPorts = 1>
ST_1 : Operation 18 [1/1] (0.78ns)   --->   "%icmp_ln9 = icmp_eq  i10 %i1_load, i10 783" [cnn.cpp:9]   --->   Operation 18 'icmp' 'icmp_ln9' <Predicate = true> <Delay = 0.78> <CoreInst = "Cmp">   --->   Core 9 'Cmp' <Latency = 0> <II = 1> <Delay = 0.78> <FuncUnit> <Opcode : 'seteq' 'setne' 'setle' 'setge' 'setlt' 'setgt'> <InPorts = 2> <OutPorts = 1>
ST_1 : Operation 19 [1/1] (0.42ns)   --->   "%store_ln9 = store i10 %i, i10 %i1" [cnn.cpp:9]   --->   Operation 19 'store' 'store_ln9' <Predicate = true> <Delay = 0.42>
ST_1 : Operation 20 [1/1] (0.00ns)   --->   "%br_ln9 = br i1 %icmp_ln9, void %for.inc.split, void %for.end" [cnn.cpp:9]   --->   Operation 20 'br' 'br_ln9' <Predicate = true> <Delay = 0.00>
ST_1 : Operation 21 [1/1] (0.42ns)   --->   "%ret_ln16 = ret" [cnn.cpp:16]   --->   Operation 21 'ret' 'ret_ln16' <Predicate = (icmp_ln9)> <Delay = 0.42>


============================================================
+ Verbose Summary: Timing violations
============================================================
Target clock period: 10.000ns, clock uncertainty: 2.700ns.

 <State 1>: 1.917ns
The critical path consists of the following:
	axis read operation ('empty', cnn.cpp:11) on port 'in_stream_V_data_V' (cnn.cpp:11) [20]  (0.079 ns)
	fifo write operation ('write_ln14', cnn.cpp:14) on port 'img_stream' (cnn.cpp:14) [22]  (1.838 ns)


============================================================
+ Verbose Summary: Binding
============================================================
N/A
* FSMD analyzer results:
  - Output states:
 - Input state : 
  - Chain level:
	State 1


============================================================
+ Verbose Summary: Datapath Resource usage 
============================================================
N/A
